{
  "type": "perk",
  "name": "trendsetter",
  "folder": null,
  "system": {
    "sourceType": "calling",
    "type": "privilege",
    "preconditions": [
      [
        {
          "type": "capability",
          "slug": "commons_customs"
        }
      ],
      [
        {
          "type": "capability",
          "slug": "court_customs"
        }
      ]
    ],
    "description": "",
    "benefice": "",
    "slug": "trendsetter"
  },
  "_id": "y1BrMAyaQ9SxFAcS",
  "img": "icons/magic/control/buff-flight-wings-blue.webp",
  "effects": [],
  "flags": {},
  "_stats": {
    "compendiumSource": null,
    "duplicateSource": null,
    "exportSource": null,
    "coreVersion": "13.350",
    "systemId": "fading-suns-4",
    "systemVersion": "0.0.1",
    "createdTime": 1760795828230,
    "modifiedTime": 1760801372488,
    "lastModifiedBy": "ef54fWvGiyPGgegN"
  },
  "ownership": {
    "default": 0,
    "ef54fWvGiyPGgegN": 3
  },
  "sort": 22800000,
  "_key": "!items!y1BrMAyaQ9SxFAcS"
}