{
  "name": "fencing_serpentis",
  "type": "perk",
  "img": "icons/magic/control/buff-flight-wings-blue.webp",
  "system": {
    "slug": "fencing_serpentis",
    "description": "",
    "sourceType": "class",
    "type": "ability",
    "benefice": "",
    "preconditions": [
      [
        {
          "type": "class",
          "slug": "noble"
        }
      ],
      [
        {
          "type": "special",
          "slug": "performing_arts_dancing"
        }
      ]
    ],
    "nextLevel": "fencing_serpentis_2"
  },
  "effects": [],
  "folder": null,
  "ownership": {
    "default": 0,
    "ef54fWvGiyPGgegN": 3
  },
  "flags": {},
  "_stats": {
    "compendiumSource": null,
    "duplicateSource": null,
    "exportSource": null,
    "coreVersion": "13.350",
    "systemId": "fading-suns-4",
    "systemVersion": "0.0.1",
    "createdTime": 1760801385161,
    "modifiedTime": 1760801385161,
    "lastModifiedBy": "ef54fWvGiyPGgegN"
  },
  "_id": "jQ1PjedsNOwLkEAD",
  "sort": 0,
  "_key": "!items!jQ1PjedsNOwLkEAD"
}
