{
  "name": "riches_5",
  "type": "perk",
  "img": "icons/magic/control/buff-flight-wings-blue.webp",
  "system": {
    "slug": "riches_5",
    "description": "",
    "sourceType": "class",
    "type": "privilege",
    "benefice": "",
    "preconditions": [
      [
        {
          "type": "class",
          "slug": "noble"
        }
      ],
      [
        {
          "type": "class",
          "slug": "priest"
        }
      ],
      [
        {
          "type": "class",
          "slug": "merchant"
        }
      ]
    ],
    "previousLevel": "riches_4"
  },
  "effects": [],
  "folder": null,
  "ownership": {
    "default": 0,
    "ef54fWvGiyPGgegN": 3
  },
  "flags": {},
  "_stats": {
    "compendiumSource": null,
    "duplicateSource": null,
    "exportSource": null,
    "coreVersion": "13.350",
    "systemId": "fading-suns-4",
    "systemVersion": "0.0.1",
    "createdTime": 1760801404212,
    "modifiedTime": 1760801404212,
    "lastModifiedBy": "ef54fWvGiyPGgegN"
  },
  "_id": "QSdX2rQ7OoVx7XZZ",
  "sort": 0,
  "_key": "!items!QSdX2rQ7OoVx7XZZ"
}
