{
  "type": "perk",
  "name": "criminal_archive_access",
  "folder": null,
  "system": {
    "sourceType": "calling",
    "type": "privilege",
    "preconditions": [
      [
        {
          "type": "calling",
          "slug": "bounty_hunter"
        }
      ],
      [
        {
          "type": "calling",
          "slug": "detective"
        }
      ],
      [
        {
          "type": "calling",
          "slug": "scribe"
        }
      ]
    ],
    "description": "",
    "benefice": "",
    "slug": "criminal_archive_access"
  },
  "_id": "xtw0nkhLCQXeAWOa",
  "img": "icons/magic/control/buff-flight-wings-blue.webp",
  "effects": [],
  "flags": {},
  "_stats": {
    "compendiumSource": null,
    "duplicateSource": null,
    "exportSource": null,
    "coreVersion": "13.350",
    "systemId": "fading-suns-4",
    "systemVersion": "0.0.1",
    "createdTime": 1760795828230,
    "modifiedTime": 1760801372488,
    "lastModifiedBy": "ef54fWvGiyPGgegN"
  },
  "ownership": {
    "default": 0,
    "ef54fWvGiyPGgegN": 3
  },
  "sort": 22600000,
  "_key": "!items!xtw0nkhLCQXeAWOa"
}
