{
  "type": "perk",
  "name": "guild_commission_3",
  "folder": null,
  "system": {
    "slug": "guild_commission_3",
    "description": "",
    "benefice": "",
    "preconditions": [
      [
        {
          "type": "class",
          "slug": "merchant"
        }
      ]
    ],
    "sourceType": "class",
    "type": "privilege",
    "previousLevel": "guild_commission_2",
    "nextLevel": "guild_commission_4"
  },
  "_id": "90UWdCbOtLxj2rMP",
  "img": "icons/magic/control/buff-flight-wings-blue.webp",
  "effects": [],
  "flags": {},
  "_stats": {
    "compendiumSource": null,
    "duplicateSource": null,
    "exportSource": null,
    "coreVersion": "13.350",
    "systemId": "fading-suns-4",
    "systemVersion": "0.0.1",
    "createdTime": 1760897715440,
    "modifiedTime": 1760897715440,
    "lastModifiedBy": "ef54fWvGiyPGgegN"
  },
  "ownership": {
    "default": 0,
    "ef54fWvGiyPGgegN": 3
  },
  "sort": 0,
  "_key": "!items!90UWdCbOtLxj2rMP"
}
