{
  "name": "fencing_kraxi_2",
  "type": "perk",
  "img": "icons/magic/control/buff-flight-wings-blue.webp",
  "system": {
    "slug": "fencing_kraxi_2",
    "description": "",
    "sourceType": "class",
    "type": "ability",
    "benefice": "",
    "preconditions": [
      [
        {
          "type": "faction",
          "slug": "decados"
        },
        {
          "type": "class",
          "slug": "merchant"
        },
        {
          "type": "species",
          "slug": "ukar"
        }
      ]
    ],
    "previousLevel": "fencing_kraxi"
  },
  "effects": [],
  "folder": null,
  "ownership": {
    "default": 0,
    "ef54fWvGiyPGgegN": 3
  },
  "flags": {},
  "_stats": {
    "compendiumSource": null,
    "duplicateSource": null,
    "exportSource": null,
    "coreVersion": "13.350",
    "systemId": "fading-suns-4",
    "systemVersion": "0.0.1",
    "createdTime": 1760801384449,
    "modifiedTime": 1760801384449,
    "lastModifiedBy": "ef54fWvGiyPGgegN"
  },
  "_id": "gUjWCydtqvhopez4",
  "sort": 0,
  "_key": "!items!gUjWCydtqvhopez4"
}