{
  "type": "perk",
  "name": "reeve_advocate",
  "folder": null,
  "system": {
    "sourceType": "calling",
    "type": "privilege",
    "preconditions": [
      [
        {
          "type": "perk",
          "slug": "riches",
          "value": "2"
        }
      ]
    ],
    "description": "",
    "benefice": "",
    "slug": "reeve_advocate"
  },
  "_id": "gXtIbAZjZow1C7Mw",
  "img": "icons/magic/control/buff-flight-wings-blue.webp",
  "effects": [],
  "flags": {},
  "_stats": {
    "compendiumSource": null,
    "duplicateSource": null,
    "exportSource": null,
    "coreVersion": "13.350",
    "systemId": "fading-suns-4",
    "systemVersion": "0.0.1",
    "createdTime": 1760795828230,
    "modifiedTime": 1760801372488,
    "lastModifiedBy": "ef54fWvGiyPGgegN"
  },
  "ownership": {
    "default": 0,
    "ef54fWvGiyPGgegN": 3
  },
  "sort": 16300000,
  "_key": "!items!gXtIbAZjZow1C7Mw"
}