{
  "type": "perk",
  "name": "gossip_network",
  "folder": null,
  "system": {
    "sourceType": "calling",
    "type": "privilege",
    "preconditions": [
      [
        {
          "type": "special",
          "slug": "one_plus_customs"
        }
      ]
    ],
    "description": "",
    "benefice": "",
    "slug": "gossip_network"
  },
  "_id": "Bv0jhNTbWq6hZWgz",
  "img": "icons/magic/control/buff-flight-wings-blue.webp",
  "effects": [],
  "flags": {},
  "_stats": {
    "compendiumSource": null,
    "duplicateSource": null,
    "exportSource": null,
    "coreVersion": "13.350",
    "systemId": "fading-suns-4",
    "systemVersion": "0.0.1",
    "createdTime": 1760795828230,
    "modifiedTime": 1760801372488,
    "lastModifiedBy": "ef54fWvGiyPGgegN"
  },
  "ownership": {
    "default": 0,
    "ef54fWvGiyPGgegN": 3
  },
  "sort": 4300000,
  "_key": "!items!Bv0jhNTbWq6hZWgz"
}
