{
  "name": "martial_arts_graa",
  "type": "perk",
  "img": "icons/magic/control/buff-flight-wings-blue.webp",
  "system": {
    "slug": "martial_arts_graa",
    "description": "",
    "sourceType": "class",
    "type": "ability",
    "benefice": "",
    "preconditions": [
      [
        {
          "type": "species",
          "slug": "vorox"
        }
      ]
    ],
    "nextLevel": "martial_arts_graa_2"
  },
  "effects": [],
  "folder": null,
  "ownership": {
    "default": 0,
    "ef54fWvGiyPGgegN": 3
  },
  "flags": {},
  "_stats": {
    "compendiumSource": null,
    "duplicateSource": null,
    "exportSource": null,
    "coreVersion": "13.350",
    "systemId": "fading-suns-4",
    "systemVersion": "0.0.1",
    "createdTime": 1760801390235,
    "modifiedTime": 1760801390235,
    "lastModifiedBy": "ef54fWvGiyPGgegN"
  },
  "_id": "1xpqcFADszqWPZgF",
  "sort": 0,
  "_key": "!items!1xpqcFADszqWPZgF"
}