{
  "type": "perk",
  "name": "savings",
  "folder": null,
  "system": {
    "sourceType": "calling",
    "type": "verve",
    "preconditions": [
      [
        {
          "type": "calling",
          "slug": "banker"
        }
      ],
      [
        {
          "type": "calling",
          "slug": "thief"
        }
      ],
      [
        {
          "type": "calling",
          "slug": "trader"
        }
      ]
    ],
    "description": "",
    "benefice": "",
    "slug": "savings"
  },
  "_id": "YcK50oE3tz2BEbV8",
  "img": "icons/magic/control/buff-flight-wings-blue.webp",
  "effects": [],
  "flags": {},
  "_stats": {
    "compendiumSource": null,
    "duplicateSource": null,
    "exportSource": null,
    "coreVersion": "13.350",
    "systemId": "fading-suns-4",
    "systemVersion": "0.0.1",
    "createdTime": 1760795828230,
    "modifiedTime": 1760801372488,
    "lastModifiedBy": "ef54fWvGiyPGgegN"
  },
  "ownership": {
    "default": 0,
    "ef54fWvGiyPGgegN": 3
  },
  "sort": 13600000,
  "_key": "!items!YcK50oE3tz2BEbV8"
}