{
  "type": "perk",
  "name": "dance_of_destruction",
  "folder": null,
  "system": {
    "sourceType": "calling",
    "type": "ability",
    "preconditions": [
      [
        {
          "type": "calling",
          "slug": "duelist"
        }
      ]
    ],
    "description": "",
    "benefice": "",
    "slug": "dance_of_destruction"
  },
  "_id": "F8pz0KYjiG7fG7FP",
  "img": "icons/magic/control/buff-flight-wings-blue.webp",
  "effects": [],
  "flags": {},
  "_stats": {
    "compendiumSource": null,
    "duplicateSource": null,
    "exportSource": null,
    "coreVersion": "13.350",
    "systemId": "fading-suns-4",
    "systemVersion": "0.0.1",
    "createdTime": 1760795828230,
    "modifiedTime": 1760801372488,
    "lastModifiedBy": "ef54fWvGiyPGgegN"
  },
  "ownership": {
    "default": 0,
    "ef54fWvGiyPGgegN": 3
  },
  "sort": 5900000,
  "_key": "!items!F8pz0KYjiG7fG7FP"
}