{
  "type": "perk",
  "name": "oral_memory",
  "folder": null,
  "system": {
    "sourceType": "calling",
    "type": "ability",
    "preconditions": [
      [
        {
          "type": "species",
          "slug": "obun"
        },
        {
          "type": "special",
          "slug": "obun_education"
        }
      ]
    ],
    "description": "",
    "benefice": "",
    "slug": "oral_memory"
  },
  "_id": "DdhIYOSZX988uDz5",
  "img": "icons/magic/control/buff-flight-wings-blue.webp",
  "effects": [],
  "flags": {},
  "_stats": {
    "compendiumSource": null,
    "duplicateSource": null,
    "exportSource": null,
    "coreVersion": "13.350",
    "systemId": "fading-suns-4",
    "systemVersion": "0.0.1",
    "createdTime": 1760795828230,
    "modifiedTime": 1760801372488,
    "lastModifiedBy": "ef54fWvGiyPGgegN"
  },
  "ownership": {
    "default": 0,
    "ef54fWvGiyPGgegN": 3
  },
  "sort": 5100000,
  "_key": "!items!DdhIYOSZX988uDz5"
}