{
  "type": "perk",
  "name": "saint_lextius_blessing",
  "folder": null,
  "system": {
    "sourceType": "class",
    "type": "verve",
    "preconditions": [
      [
        {
          "type": "class",
          "slug": "noble"
        }
      ]
    ],
    "description": "",
    "benefice": "",
    "slug": "saint_lextius_blessing"
  },
  "_id": "vkJmncC8UzyrXnRc",
  "img": "icons/magic/control/buff-flight-wings-blue.webp",
  "effects": [],
  "flags": {},
  "_stats": {
    "compendiumSource": null,
    "duplicateSource": null,
    "exportSource": null,
    "coreVersion": "13.350",
    "systemId": "fading-suns-4",
    "systemVersion": "0.0.1",
    "createdTime": 1760795828230,
    "modifiedTime": 1760801372488,
    "lastModifiedBy": "ef54fWvGiyPGgegN"
  },
  "ownership": {
    "default": 0,
    "ef54fWvGiyPGgegN": 3
  },
  "sort": 21800000,
  "_key": "!items!vkJmncC8UzyrXnRc"
}