{
  "name": "martial_arts_iron_heel",
  "type": "perk",
  "img": "icons/magic/control/buff-flight-wings-blue.webp",
  "system": {
    "slug": "martial_arts_iron_heel",
    "description": "",
    "sourceType": "class",
    "type": "ability",
    "benefice": "",
    "preconditions": [
      [
        {
          "type": "faction",
          "slug": "the_muster"
        },
        {
          "type": "calling",
          "slug": "bounty_hunter"
        },
        {
          "type": "calling",
          "slug": "chainer"
        },
        {
          "type": "calling",
          "slug": "mercenary"
        }
      ]
    ],
    "nextLevel": "martial_arts_iron_heel_2"
  },
  "effects": [],
  "folder": null,
  "ownership": {
    "default": 0,
    "ef54fWvGiyPGgegN": 3
  },
  "flags": {},
  "_stats": {
    "compendiumSource": null,
    "duplicateSource": null,
    "exportSource": null,
    "coreVersion": "13.350",
    "systemId": "fading-suns-4",
    "systemVersion": "0.0.1",
    "createdTime": 1760801391856,
    "modifiedTime": 1760801391856,
    "lastModifiedBy": "ef54fWvGiyPGgegN"
  },
  "_id": "NK6aKAB9HhSxJZ9j",
  "sort": 0,
  "_key": "!items!NK6aKAB9HhSxJZ9j"
}